{
  "game": "Riftbound",
  "version": "1.0.0",
  "lastUpdated": "2026-02-20",
  "sets": [
    {
      "id": "Origins",
      "name": "Origins",
      "cards": [
        {
          "id": "OGN-001",
          "name": "Blazing Scorcher",
          "type": "Unit",
          "rarity": "Common",
          "collectorNumber": 1,
          "faction": "Fury",
          "stats": {
            "cost": 1,
            "might": 2,
            "energy": 1,
            "power": 0
          },
          "keywords": [],
          "description": "A fiery warrior who strikes fast and burns bright.",
          "flavorText": "The flame needs no invitation.",
          "set": "Origins",
          "art": {
            "thumbnailURL": "",
            "fullURL": "",
            "artist": "Riot Games"
          },
          "tags": []
        },
        {
          "id": "OGN-007",
          "name": "Fury Rune",
          "type": "Rune",
          "rarity": "Common",
          "collectorNumber": 7,
          "faction": "Fury",
          "stats": {
            "cost": 0,
            "might": 0,
            "energy": 0,
            "power": 0
          },
          "keywords": [],
          "description": "A rune channeling the raw power of Fury.",
          "flavorText": "Rage given form.",
          "set": "Origins",
          "art": {
            "thumbnailURL": "",
            "fullURL": "",
            "artist": "Riot Games"
          },
          "tags": []
        },
        {
          "id": "OGN-008",
          "name": "Get Excited!",
          "type": "Spell",
          "rarity": "Common",
          "collectorNumber": 8,
          "faction": "Fury",
          "stats": {
            "cost": 3,
            "might": 0,
            "energy": 0,
            "power": 0
          },
          "keywords": ["Fast"],
          "description": "Deal 3 damage to anything.",
          "flavorText": "BOOM! Hahaha!",
          "set": "Origins",
          "art": {
            "thumbnailURL": "",
            "fullURL": "",
            "artist": "Riot Games"
          },
          "tags": []
        },
        {
          "id": "OGN-015",
          "name": "Captain Farron",
          "type": "Unit",
          "rarity": "Uncommon",
          "collectorNumber": 15,
          "faction": "Fury",
          "stats": {
            "cost": 8,
            "might": 8,
            "energy": 6,
            "power": 0
          },
          "keywords": ["Overwhelm"],
          "description": "When I'm summoned, create 3 Decimates in hand.",
          "flavorText": "The battlefield bends to his command.",
          "set": "Origins",
          "art": {
            "thumbnailURL": "",
            "fullURL": "",
            "artist": "Riot Games"
          },
          "tags": []
        },
        {
          "id": "OGN-027",
          "name": "Darius, Trifarian",
          "type": "Champion",
          "rarity": "Rare",
          "collectorNumber": 27,
          "faction": "Fury",
          "stats": {
            "cost": 6,
            "might": 6,
            "energy": 5,
            "power": 0
          },
          "keywords": ["Overwhelm"],
          "description": "The Hand of Noxus demands absolute strength.",
          "flavorText": "They will kneel, or they will fall.",
          "set": "Origins",
          "art": {
            "thumbnailURL": "",
            "fullURL": "",
            "artist": "Riot Games"
          },
          "tags": []
        },
        {
          "id": "OGN-043",
          "name": "Charm",
          "type": "Spell",
          "rarity": "Common",
          "collectorNumber": 43,
          "faction": "Calm",
          "stats": {
            "cost": 2,
            "might": 0,
            "energy": 0,
            "power": 0
          },
          "keywords": ["Fast"],
          "description": "Recall a unit.",
          "flavorText": "A glance that steals the heart and stills the blade.",
          "set": "Origins",
          "art": {
            "thumbnailURL": "",
            "fullURL": "",
            "artist": "Riot Games"
          },
          "tags": []
        },
        {
          "id": "OGN-051",
          "name": "Solari Shieldbearer",
          "type": "Unit",
          "rarity": "Common",
          "collectorNumber": 51,
          "faction": "Calm",
          "stats": {
            "cost": 2,
            "might": 2,
            "energy": 3,
            "power": 0
          },
          "keywords": [],
          "description": "Daybreak: Grant me +0|+2.",
          "flavorText": "The sun's light is her armor and her oath.",
          "set": "Origins",
          "art": {
            "thumbnailURL": "",
            "fullURL": "",
            "artist": "Riot Games"
          },
          "tags": []
        },
        {
          "id": "OGN-066",
          "name": "Ahri, Alluring",
          "type": "Champion",
          "rarity": "Rare",
          "collectorNumber": 66,
          "faction": "Calm",
          "stats": {
            "cost": 4,
            "might": 4,
            "energy": 3,
            "power": 0
          },
          "keywords": ["Quick Attack"],
          "description": "When allies are recalled, I gain +1|+0.",
          "flavorText": "Every soul holds a story worth hearing.",
          "set": "Origins",
          "art": {
            "thumbnailURL": "",
            "fullURL": "",
            "artist": "Riot Games"
          },
          "tags": []
        },
        {
          "id": "OGN-078",
          "name": "Lee Sin, Ascetic",
          "type": "Champion",
          "rarity": "Epic",
          "collectorNumber": 78,
          "faction": "Calm",
          "stats": {
            "cost": 6,
            "might": 3,
            "energy": 6,
            "power": 0
          },
          "keywords": ["Barrier"],
          "description": "When you cast a spell, grant me Challenger this round.",
          "flavorText": "The dragon's will flows through disciplined hands.",
          "set": "Origins",
          "art": {
            "thumbnailURL": "",
            "fullURL": "",
            "artist": "Riot Games"
          },
          "tags": []
        },
        {
          "id": "OGN-084",
          "name": "Eager Apprentice",
          "type": "Unit",
          "rarity": "Common",
          "collectorNumber": 84,
          "faction": "Mind",
          "stats": {
            "cost": 2,
            "might": 2,
            "energy": 1,
            "power": 0
          },
          "keywords": [],
          "description": "When I'm summoned, refill 2 spell mana.",
          "flavorText": "She studies the arcane with reckless enthusiasm.",
          "set": "Origins",
          "art": {
            "thumbnailURL": "",
            "fullURL": "",
            "artist": "Riot Games"
          },
          "tags": []
        },
        {
          "id": "OGN-089",
          "name": "Mind Rune",
          "type": "Rune",
          "rarity": "Common",
          "collectorNumber": 89,
          "faction": "Mind",
          "stats": {
            "cost": 0,
            "might": 0,
            "energy": 0,
            "power": 0
          },
          "keywords": [],
          "description": "A rune channeling the infinite depths of Mind.",
          "flavorText": "Knowledge is the truest weapon.",
          "set": "Origins",
          "art": {
            "thumbnailURL": "",
            "fullURL": "",
            "artist": "Riot Games"
          },
          "tags": []
        },
        {
          "id": "OGN-111",
          "name": "Heimerdinger, Inventor",
          "type": "Champion",
          "rarity": "Rare",
          "collectorNumber": 111,
          "faction": "Mind",
          "stats": {
            "cost": 5,
            "might": 1,
            "energy": 3,
            "power": 0
          },
          "keywords": [],
          "description": "When you play a spell, create a turret of equal cost.",
          "flavorText": "Innovation requires a keen mind and an even keener turret.",
          "set": "Origins",
          "art": {
            "thumbnailURL": "",
            "fullURL": "",
            "artist": "Riot Games"
          },
          "tags": []
        },
        {
          "id": "OGN-117",
          "name": "Viktor, Innovator",
          "type": "Champion",
          "rarity": "Epic",
          "collectorNumber": 117,
          "faction": "Mind",
          "stats": {
            "cost": 5,
            "might": 3,
            "energy": 4,
            "power": 0
          },
          "keywords": [],
          "description": "When you play a created card, grant me a random keyword.",
          "flavorText": "Evolution is not a choice. It is an inevitability.",
          "set": "Origins",
          "art": {
            "thumbnailURL": "",
            "fullURL": "",
            "artist": "Riot Games"
          },
          "tags": []
        },
        {
          "id": "OGN-121",
          "name": "Teemo, Strategist",
          "type": "Champion",
          "rarity": "Epic",
          "collectorNumber": 121,
          "faction": "Mind",
          "stats": {
            "cost": 1,
            "might": 1,
            "energy": 1,
            "power": 0
          },
          "keywords": ["Elusive"],
          "description": "Strike: Plant 5 Poison Mushrooms in the enemy deck.",
          "flavorText": "Size means nothing when you know every hiding spot.",
          "set": "Origins",
          "art": {
            "thumbnailURL": "",
            "fullURL": "",
            "artist": "Riot Games"
          },
          "tags": []
        },
        {
          "id": "OGN-124",
          "name": "Arena Bar",
          "type": "Battlefield",
          "rarity": "Common",
          "collectorNumber": 124,
          "faction": "Body",
          "stats": {
            "cost": 3,
            "might": 0,
            "energy": 0,
            "power": 0
          },
          "keywords": [],